{
  "$schema": "http://json-schema.org/draft-07/schema#",
  "$id": "https://raw.githubusercontent.com/lliangcol/llm-plugins-fusion/main/schemas/eval-result.schema.json",
  "title": "Workflow evaluation result",
  "type": "object",
  "additionalProperties": false,
  "required": ["schemaVersion", "layer", "executionMode", "workflowSpecSha256", "cases", "summary", "claimBoundary"],
  "properties": {
    "$schema": { "type": "string" },
    "schemaVersion": { "const": 1 },
    "layer": { "enum": ["static-contract", "adapter-simulation", "live-assistant"] },
    "executionMode": { "type": "string" },
    "workflowSpecSha256": { "type": "string", "pattern": "^[a-f0-9]{64}$" },
    "sourceDigests": { "type": "object" },
    "baseCommit": { "type": "string" },
    "sourceState": { "type": "string" },
    "assistant": { "type": "object" },
    "startedAt": { "type": "string" },
    "completedAt": { "type": "string" },
    "cases": { "type": "array", "minItems": 1, "items": { "type": "object" } },
    "summary": { "type": "object" },
    "claimBoundary": { "type": "string", "minLength": 1 }
  }
}
