{
  "$schema": "../../schemas/eval-result.schema.json",
  "schemaVersion": 1,
  "layer": "adapter-simulation",
  "executionMode": "deterministic-adapter-simulation",
  "workflowSpecSha256": "a0004c565a7984f7e1b3a24187c4d3961755d7f7c06bd04efcd5d2f5d3878608",
  "cases": [
    {
      "id": "missing-required-input",
      "expectedDecision": "blocked-missing-input",
      "decision": "blocked-missing-input",
      "reasons": [
        "PLAN_APPROVED"
      ],
      "passed": true
    },
    {
      "id": "write-approval-absent",
      "expectedDecision": "blocked-approval",
      "decision": "blocked-approval",
      "reasons": [
        "workspaceWrite"
      ],
      "passed": true
    },
    {
      "id": "read-only-review",
      "expectedDecision": "ready",
      "decision": "ready",
      "reasons": [],
      "passed": true
    },
    {
      "id": "required-network-unavailable",
      "expectedDecision": "fallback-unsupported-capability",
      "decision": "fallback-unsupported-capability",
      "reasons": [
        "network"
      ],
      "passed": true
    },
    {
      "id": "required-credentials-unapproved",
      "expectedDecision": "blocked-approval",
      "decision": "blocked-approval",
      "reasons": [
        "credentials"
      ],
      "passed": true
    },
    {
      "id": "external-review-approved",
      "expectedDecision": "ready",
      "decision": "ready",
      "reasons": [],
      "passed": true
    },
    {
      "id": "unknown-assistant",
      "expectedDecision": "fallback-advisory",
      "decision": "fallback-advisory",
      "reasons": [
        "unknown assistant"
      ],
      "passed": true
    },
    {
      "id": "unknown-workflow",
      "expectedDecision": "blocked-unknown-workflow",
      "decision": "blocked-unknown-workflow",
      "reasons": [
        "unknown workflow"
      ],
      "passed": true
    }
  ],
  "summary": {
    "total": 8,
    "passed": 8,
    "fallbackCases": 2,
    "unsafeContinuation": 0
  },
  "claimBoundary": "Deterministic adapter-state simulation only; no assistant process, network, latency, token, or model-quality claim."
}
